{
  "$schema": "./schemas/workflow-catalog.schema.json",
  "schema": "egohygiene.relay-workflow-catalog/v1",
  "schema_version": 1,
  "owner": "egohygiene/relay",
  "release_model": {
    "unit": "repository",
    "immutable": "vMAJOR.MINOR.PATCH",
    "moving_alias": "vMAJOR",
    "recommended_consumer_pin": "full-commit-sha"
  },
  "security_policy": {
    "default_permissions": {"contents": "read"},
    "write_permissions": "job-scoped-and-purpose-bound",
    "remote_dependencies": "full-commit-sha",
    "reusable_local_dependencies": "exact-called-relay-revision",
    "forbidden_triggers": ["pull_request_target"]
  },
  "workflows": [
    {
      "id": "artifact-budget",
      "path": ".github/workflows/artifact-budget.yml",
      "owner": "egohygiene/relay",
      "purpose": "Download caller-produced current and baseline artifacts under read-only authority, normalize bounded size evidence, and preserve deterministic advisory or blocking reports without executing consumer code.",
      "audience": "reusable",
      "status": "beta",
      "triggers": ["workflow_call"],
      "permissions": {"contents": "read"},
      "timeout_minutes": 10,
      "concurrency": {"group": "relay-artifact-budget-${{ github.repository }}-${{ github.ref }}", "cancel_in_progress": true},
      "failure_semantics": {"mode": "fail-closed", "partial_success": false, "retry": "fresh-run", "description": "Invalid, missing, incomplete, or unsupported evidence and artifact transfer failures remain explicit; blocking mode preserves a completed report before failing the job, while advisory mode reports the same state without mutation."},
      "inputs": [
        {"name": "current-artifact-name", "type": "string", "required": true, "description": "Ordinary caller-produced Actions artifact containing current evidence."},
        {"name": "baseline-artifact-name", "type": "string", "required": false, "default": "", "description": "Optional ordinary caller-produced Actions artifact containing baseline evidence."},
        {"name": "artifact-path", "type": "string", "required": false, "default": ".", "description": "Path within the downloaded current artifact to measure or normalize."},
        {"name": "baseline-artifact-path", "type": "string", "required": false, "default": ".", "description": "Path within the downloaded baseline artifact to measure or normalize."},
        {"name": "adapter", "type": "string", "required": true, "description": "Measurement adapter: filesystem or size-limit-json."},
        {"name": "artifact-kind", "type": "string", "required": true, "description": "Artifact class measured by the selected adapter."},
        {"name": "subject", "type": "string", "required": true, "description": "Stable bounded identifier for the measured artifact or group."},
        {"name": "current-revision", "type": "string", "required": true, "description": "Full Git SHA represented by the current artifact."},
        {"name": "baseline-revision", "type": "string", "required": false, "default": "", "description": "Full Git SHA represented by the optional baseline artifact."},
        {"name": "mode", "type": "string", "required": false, "default": "advisory", "description": "Advisory preserves all states; blocking fails on failed, missing, or unsupported evidence."},
        {"name": "maximum-bytes", "type": "string", "required": false, "default": "", "description": "Optional absolute byte budget applied to every measurement."},
        {"name": "maximum-increase-bytes", "type": "string", "required": false, "default": "", "description": "Optional maximum byte increase over baseline."},
        {"name": "maximum-increase-percent", "type": "string", "required": false, "default": "", "description": "Optional maximum percentage increase over baseline."},
        {"name": "warning-threshold-percent", "type": "string", "required": false, "default": "90", "description": "Percentage of a hard budget at which a passing value becomes a warning."},
        {"name": "maximum-files", "type": "number", "required": false, "default": 10000, "description": "Maximum filesystem entries scanned in each directory artifact."},
        {"name": "maximum-items", "type": "number", "required": false, "default": 100, "description": "Maximum Size Limit checks normalized per JSON input."},
        {"name": "scan-maximum-bytes", "type": "number", "required": false, "default": 1073741824, "description": "Maximum raw bytes accepted from each artifact or Size Limit JSON document."},
        {"name": "artifact-retention-days", "type": "number", "required": false, "default": 30, "description": "Retention for the normalized machine-readable budget report."}
      ],
      "outputs": [
        {"name": "report-artifact-name", "type": "string", "required": true, "description": "Uploaded artifact containing the deterministic budget report."},
        {"name": "report-sha256", "type": "string", "required": true, "description": "SHA-256 of the exact deterministic JSON report."},
        {"name": "status", "type": "string", "required": true, "description": "Overall normalized budget state."},
        {"name": "measurement-count", "type": "string", "required": true, "description": "Number of normalized artifact measurements."}
      ],
      "consumer_ref": "egohygiene/relay/.github/workflows/artifact-budget.yml@v1"
    },
    {
      "id": "continuity-preflight",
      "path": ".github/workflows/continuity-preflight.yml",
      "owner": "egohygiene/relay",
      "purpose": "Validate explicit repository continuity base/head evidence through the pinned EgoLint source and preserve one bounded privacy-safe artifact.",
      "audience": "reusable",
      "status": "experimental",
      "triggers": ["workflow_call"],
      "permissions": {"contents": "read"},
      "timeout_minutes": 15,
      "concurrency": {"group": "relay-continuity-preflight-${{ github.repository }}-${{ github.ref }}", "cancel_in_progress": true},
      "failure_semantics": {"mode": "fail-closed", "partial_success": false, "retry": "fresh-run", "description": "Invalid inputs, unavailable pinned source, missing history, incompatible evidence, or upload failure fails the workflow without mutating repository state."},
      "inputs": [
        {"name": "repository-id", "type": "string", "required": true, "description": "Exact owner/name identity."},
        {"name": "visibility", "type": "string", "required": true, "description": "Repository visibility."},
        {"name": "base-revision", "type": "string", "required": true, "description": "Full base SHA or unborn."},
        {"name": "head-revision", "type": "string", "required": false, "default": "working-tree", "description": "Full head SHA or working-tree."},
        {"name": "disposition", "type": "string", "required": true, "description": "Continuity update disposition."},
        {"name": "exception-reference", "type": "string", "required": false, "default": "", "description": "Stable reviewed exception URL; required with exception disposition."},
        {"name": "transition", "type": "string", "required": false, "default": "pull-request", "description": "Evaluated transition."},
        {"name": "rollout-mode", "type": "string", "required": false, "default": "observe", "description": "Observe, ratchet, or enforce."},
        {"name": "evaluation-date", "type": "string", "required": true, "description": "Explicit evaluation date or event timestamp."},
        {"name": "continuity-policy", "type": "string", "required": false, "default": ".config/continuity/repository-continuity.toml", "description": "Repository-relative policy path."},
        {"name": "live-evidence-status", "type": "string", "required": false, "default": "unavailable", "description": "External live evidence state."},
        {"name": "live-evidence-references", "type": "string", "required": false, "default": "[]", "description": "JSON stable-reference array."},
        {"name": "parallel-heads", "type": "string", "required": false, "default": "[]", "description": "JSON parallel-head array."},
        {"name": "artifact-retention-days", "type": "number", "required": false, "default": 14, "description": "Evidence retention in days."}
      ],
      "outputs": [
        {"name": "outcome", "type": "string", "required": true, "description": "Normalized enforcement outcome."},
        {"name": "evidence-artifact-name", "type": "string", "required": true, "description": "Bounded evidence artifact name."}
      ],
      "consumer_ref": "egohygiene/relay/.github/workflows/continuity-preflight.yml@v1"
    },
    {
      "id": "continuity-preflight-dogfood",
      "path": ".github/workflows/continuity-preflight-dogfood.yml",
      "owner": "egohygiene/relay",
      "purpose": "Exercise the reusable continuity preflight against Relay pull requests under a read-only permission ceiling.",
      "audience": "internal",
      "status": "experimental",
      "triggers": ["pull_request"],
      "permissions": {"contents": "read"},
      "timeout_minutes": null,
      "concurrency": {"group": "relay-continuity-dogfood-${{ github.ref }}", "cancel_in_progress": true},
      "failure_semantics": {"mode": "fail-closed", "partial_success": false, "retry": "fresh-run", "description": "The caller fails when reusable continuity validation or bounded evidence preservation fails."},
      "inputs": [],
      "outputs": [],
      "consumer_ref": null
    },
    {
      "id": "relay-validation",
      "path": ".github/workflows/validate.yml",
      "owner": "egohygiene/relay",
      "purpose": "Validate catalog, contracts, implementations, metadata, and the reusable-workflow smoke path.",
      "audience": "internal",
      "status": "stable",
      "triggers": ["pull_request", "push", "workflow_dispatch"],
      "permissions": {"actions": "read", "contents": "read", "issues": "read", "pull-requests": "read", "security-events": "read"},
      "timeout_minutes": 15,
      "concurrency": {